{
  "$schema": "https://json-schema.org/draft/2020-12/schema",
  "title": "Story",
  "type": "object",
  "required": ["title", "logline", "scenes", "characters", "plot_segments"],
  "properties": {
    "title": { "type": "string" },
    "logline": { "type": "string" },
    "duration_minutes": { "type": ["number", "string", "null"] },
    "genre": { "type": ["string", "null"] },
    "theme": { "type": ["string", "null"] },
    "scenes": {
      "type": "array",
      "items": {
        "type": "object",
        "required": ["scene_id", "name"],
        "properties": {
          "scene_id": { "type": "string" },
          "name": { "type": "string" },
          "time": { "type": ["string", "null"] },
          "location_desc": { "type": ["string", "null"] }
        }
      }
    },
    "characters": {
      "type": "array",
      "items": {
        "type": "object",
        "required": ["name"],
        "properties": {
          "name": { "type": "string" },
          "feature_name": { "type": ["string", "null"] },
          "visual_anchors": { "type": ["array", "string", "null"], "items": { "type": "string" } },
          "role": { "type": ["string", "null"] }
        }
      }
    },
    "plot_segments": {
      "type": "array",
      "items": {
        "type": "object",
        "required": ["segment_id", "summary"],
        "properties": {
          "segment_id": { "type": "string" },
          "summary": { "type": "string" },
          "scene_id": { "type": ["string", "null"] },
          "characters": { "type": ["array", "null"], "items": { "type": "string" } }
        }
      }
    },
    "production_notes": { "type": ["array", "string", "object", "null"] }
  }
}
